{"config_snapshot_path":"/home/naguilar/projects/quant-trading-bot/src/backtest/config_backtest.json","decisions":[{"asset_id":"JPM","outputs":{"asof_date":"2026-04-21","decision_type":"intraday","empirical_hit_rate":1.0,"empirical_mean_return":0.008709,"empirical_observations":169,"expected_return_gross_pct":0.00886,"justificacion":"model_score=0.986599 day=2026-04-21 | empirical_mean=0.008709 | empirical_hit=1.000000 | empirical_n=169 | oos_trade_mean=0.007887 | oos_trade_hit=1.000000 | oos_trade_n=76","model_score":0.986599,"peso_pct":40.38898,"selection_score":0.01311215},"signal":1.0},{"asset_id":"V","outputs":{"asof_date":"2026-04-21","decision_type":"intraday","empirical_hit_rate":0.993243,"empirical_mean_return":0.006306,"empirical_observations":148,"expected_return_gross_pct":0.006762,"justificacion":"model_score=0.995793 day=2026-04-21 | empirical_mean=0.006306 | empirical_hit=0.993243 | empirical_n=148 | oos_trade_mean=0.004581 | oos_trade_hit=1.000000 | oos_trade_n=75","model_score":0.995793,"peso_pct":31.113012,"selection_score":0.01010074},"signal":1.0},{"asset_id":"MSFT","outputs":{"asof_date":"2026-04-21","decision_type":"intraday","empirical_hit_rate":1.0,"empirical_mean_return":0.005673,"empirical_observations":135,"expected_return_gross_pct":0.006249,"justificacion":"model_score=0.986990 day=2026-04-21 | empirical_mean=0.005673 | empirical_hit=1.000000 | empirical_n=135 | oos_trade_mean=0.004468 | oos_trade_hit=1.000000 | oos_trade_n=76","model_score":0.98699,"peso_pct":28.498008,"selection_score":0.00925179},"signal":1.0}],"horizon":"SHORT","reader_min_version":"1.0.0","rule_refs":{"constraints":[],"filters":[],"sizing_rule":"size.fixed"},"run_id":"20260422-1940","schema_version":"1.0.0","strategy_id":"quant_trading_bot","variant_id":null}